"35a la novela le tenía muchas ganas quizás mis expectativas eran demasiadas la novela aunque sí me ha gustado ya que trata temas importantes y que me gusta que se les de visibilidad no me ha acabado de encantar del todo como estoy viendo que está gustando se me ha hecho incluso un poco lineal hasta básicamente el final que es cuando sí se pone del todo interesante evelyn nos va contando cada uno de sus matrimonios y bueno pues vale pero para mí sin más me ha faltado incluso saber más de monique ya que las pequeñas pinceladas que se dan no me han llegado volveré a leer a la autora ya que tengo alguna novela más de ella pero con esta no ha conseguido conquistarme del todo todo esto dentro de mi humilde opinión y de mis sensaciones en el momento en el que fue leída","4"
"engancha muy fácil de leer","5"
"la primera mitad de la novela resulta lenta y algo pesada la segunda mitad tiene ritmo y engancha lo interesante y que resaltaría de la historia es que la protagonista reconoce que todo el dinero fama y poder conseguido los cambiaría por tener alrededor a sus seres queridos y que cuenta todo lo que ha tenido que hacer/sacrificar/aceptar en su vida para llegar a ser quien era…es lo que hace esta novela diferente de otras románticas que no cuenta la historia entre dos protagonistas sino que narra la dificultad de las relaciones la influencia de la sociedad los intereses de las personas…","4"
"por favor que maravilla de libro decir que me ha encantado es quedarse muy corta preciosa y dura historia la vida de evelyn totalmente fascinante te hace tener sentimientos encontrados hacia ella y eso engancha tanto que no puedes dejar de leer de principio a fin es de esas historias que se quedan grabadas para siempre en la memoria y en el corazón","5"
"es la primera toma de contacto que tengo con esta autora y aunque esperaba algo totalmente diferente me ha gustado evelyn hugo es claramente una mezcla de las actrices más iconicas de la época dorada de hollywood y el libro tiene más chicha de lo que a simple vista puede parecer además la lectura es bastante ligera","4"
"es muy bueno lo leí en 3 días engancha","5"
"la entrega del artículo no tardó nada como siempre impecable y plazos fiablesen cuanto al libro lo recomiendo 100% me ha encantado la trama y la ambientación refleja la vida de una diva de los años 60 que hizo todo lo posible por ser alguien10 de 10","5"
"iba a ciegas sin leer la sinopsis y fue lo mejor medeclaro fan de este libro muy recomendable adictivo e inesperado","5"
"sin entrar a valorar la historia ya que en este punto ya no es necesario creo que es un libro muy regalable y likeable una apuesta segura para cuando no sabes qué leeres una lectura muy ágil y sencilla tanto para grandes lectores como para personas que no acostumbren a leer el libro se lee prácticamente solo sin que te des cuentael personaje de evelyn y la historia son muy atrapantes pero hecho en falta más páginas profundizando en otros personajes o anécdotassi dudas de si comprarlo para ti o para otra persona la respuesta es sí sin dudarlo gustará menos o más pero sin duda gustará","4"
"me mantuvo enganchada todo el rato es un libro maravilloso fácil de leer una historia apasionante y bien escrita recomendado 100%","5"
"recomendadísimo este libro me ha cautivado de principio a fin es muy entretenido pero muy duro a su vez  gracias a la autora por escribir esta historia tan preciosa","5"
"el libro llego nuevo y en perfecto estado","5"
"es un libro que me ha encantadono suelo leer esta clase de temas pero he de decir que me ha tenido enganchada de principio a fin","4"
"este libro me ha enganchado desde el principio pensé en muchas ocasiones cuan engañados estamos por la tv y como ideolizamos a gente que ni conocemos pensamos que por ser ricos no sufren y me ha trasmitido el verdadero sufrimiento de ser una estrella me ha encantado","5"
"novela que te mantiene enganchada a su lectura fácil y rápida de leer fascinante la vida de evelyn hugo leedla","4"
"de mis libros favoritos","5"
"me decidí porque todo el mundo hablaba maravillas sorpresa nopersonajes planos y ñoños sacan conflictos absurdos para seguir enredando la relación principal y lo único que consiguen esque pase lo mismo una y otra vez me ha costado mucho terminarlo","3"
"no puedo describir con palabras lo mucho que me ha gustado este libro no alcanzarían estaba en un bloqueo de lectura empezaba y dejaba libros algunos  tras leer apenas 5 páginas pero una vez empecé a leer este libro no pude parar lo he terminado en un día te atrapa te conmueve te hace enfadar llorar pero sobre todo te hace sentir muchísimo","5"
"un libro que te hace sentir muchas cosas y que desde luego se va a quedar en tu cabeza varios días después de terminarlo","5"
"no conocía a la autora pero su forma de escribir me ha encantadola historia me ha llegado muy adentro dolorosa triste dura preciosa realamor odio amistad familia realidad personajes increíbles casi no tengo palabras para describirla solo puedo recomendarla a todo el mundo","5"
"buena sensacion y todo bien","4"
"un libro increible se hace megafluido  la temàtica de la complejidad de ser famoso y la sexualidad que té condiciona para ser acceptada por una sociedad y tu publicolo super recomiendo","5"
"esta autora no defrauda tras leer el de daisy jones decidí hacerme con este y tenía buenas expectativas pero estas fueron incluso superadas para nada esperaba ciertos giros y la narración como siempre es muy amena pero intensa a momentos el final me hizo sentir miles de emociones encontradas y a flor de piel recomendadísimo","5"
"empecé a leer este libro por la cantidad de comentarios positivos que tenía pero un poco reticente porque el título me parecía de una historia poco atractiva pero he de decir que me ha encantado es una historia imponente original y que te da mucho en qué pensar sin duda lo recomiendo","5"
"es el mejor libro que he leído fácil de entender y con muchos trasfondos +21 la entrega rápida y es tal cual la foto","5"
"historio entretenida  pero algo pesada","4"
"entretenido de leer y con un argumento que me encanta lo recomiendo","4"
"la resaca emocional de semana santa que necesitabacomo se supera esto como sigo con mi vidasend help lol","5"
"lo compre porque leí opiniones que lo ponían por las nubes para nadauna novelucha sin másno atrapa la historia ni los personajeses todo muy simple","2"
"me han encantado la forma de escribir y expresar esta historia es preciosa y realista mostrando los lados buenos y malos de todos los personajes sin duda uno de los libros que releere y que se queda con un cachito de tu corazón","5"
"perfecto","3"
"fue un regalo y la persona quedó encantada con el buen tamaño calidad y libro fácil de leer","5"
"normalmente no suelo leer libros por que no me enganchan este libro me lo leí en un día me encanta la historia y hay un plot twist lo recomendaría para gente que quiere empezar a leer","4"
"ha sido un regalo pero yo ya había leído esta obra en otro formato y me gusto muchísimo lo recomendaría 100% para alguien que le gusta lectura variada además que enfoca temas bastante importantes y serios como relaciones lgtbq+ y también abuso sexual o prostitución","5"
"tengo la séptima edición y la cantidad de faltas de tildes que hay en tan sólo un par de hojas así como algunas traducciones demasiado literales sin que se ajusten bien al español hace que salgas completamente de la historia si eres consciente y te importa la ortografíano son un par de errores sin importancia como digo son bastantes muy seguidos muy mal por parte de una editorial permitir algo así","3"
"sin duda este ha sido mi descubrimiento del año un libro único que no deja indiferente a nadie historia bien narrada con giros inesperados sin duda tiene de todo dramatismo romance y momentos difíciles pero siempre en su justa medida me cuesta empatizar mucho con los libros y puedo decir que con este lo he echo ya que me ha sido imposible contener las lágrimas en varias ocasiones un libro para recordar y recomendar","5"
"me ha gustado el argumento y la forma en la que se trata el amor libre entre personasque nó entre sexos","4"
"buena lectura","5"
"preciosa historia que me ha enganchado un montón se lee muy rápido en dos días lo he terminado es el primer libro que leo de la autora y no será el último","5"
"no me atraía mucho el título ni la sinopsis pero en cuanto pasé las primeras páginas y entramos en la historia de evelyn me enganchó una trama muy bien tejida una historia de las que te enganchan unos personajes sólidos consistentes muy humanos y en especial una magnífica evelyn y un desenlace original y sorprendente que huye de clichés romanticones y de finales de comer perdices una gran novela","5"
"cuando me decidí por este título no pensé en lo que iba a encontrar en estas páginas  es maravilloso  tanto que parece  que vives  ese instante con la prota  del libro le doy 5 estrellas xq no me deja más","5"
"me ha gustado es ameno de leer y bastante entretenidola historia engancha es verdad que al principio me ha costado meterme en la historia pero después muy bien","4"
"mi descubrimiento de 2021 fue esta autora y su obra un libro muy bien escrito y contado de forma tan extraordinaria que pareces estar a solas con la protagonista original brillante y conmovedora a partes iguales súper recomendado","5"
"mucha gente hablando bien del libro yo lo he visto predecible y aunque trata temas que últimamente están de moda creo que es una novela normal","3"
"damas y caballeros con todos ustedes evelyn hugoevelyn a sus 79 años se ha propuesto contar su historia y para ello solicita los servicios de monique grantqué hay tras esa imagen de diva del cine qué hay tras esos siete matrimonios quién se llevó el corazón de la estrella quién es evelyn hugo y lo más importante cómo llegó a lo más alto durante más de tres décadasen este libro evelyn te lo cuenta todopunto negativo la traducción podría estar mucho mejor","4"
"es una historia muy buena y muy bien contada  me ha gustado muchísimo a veces pensamos qué el dinero te hace ser mas feliz pero realmente la felicidad va mas allá lo recomiendo porque  creo que este libro habla de que  lo tienes todo y en un momento te puedes quedar sin nada","5"
"me ha gustado mucho me ha entretenido y como me apasiona el cine y  mundo del hollywood clásico pues perfecto","4"
"lo que espero de una novela donde se relata una biografia en este caso de una estrella de hollywood de los años 50-60 es descubrir todas las cirscunstanciales sociales de esa época  el ambiente que rodea a los hechos narrados el contexto que te haga sentir la historia más profundamentela novela es una historia de amor a lo largo de los años puntome hubiera gustado impregnarme de ese hollywood intenso y único…pero no ha sido así en absoluto… nombrar un bar de moda o un vestido de vez en cuando no consigue ubicar e involucrar al lector en el ambiente de la historiahay algunos hechos que pueden sorprender pero no bastan… hay muchos sucesos que no interesan diálogos forzados y rebuscados situaciones que no te afectan…habia leido algunas criticas muy buenas pero para mí ha sido una lectura decepcionante","2"
"no engancha al lector y es muy previsible todo lo que sucede en cada capítulopersonajes poco atractivos y con muchos estereotipos","2"
"muy entretenido y fácil de leer","5"
"me he divertido leyéndolo y me he entretenido","4"
"amores sentidos o no mentiras la fabulosa  hollywood reflejada tal cual es en un libro que acaba enganchandote hasta el final","5"
"ojalá poder volver a leer este libro por primera vez una lectura muy recomendada me cuesta engancharme a leer muy seguido pero con este libro no podía parar de leerlo","5"
"buen libro y entretenida lectura","4"
"llego en perfecto estado y además es uno de los mejores libros que he leído","5"
"el libro es ligero entretenido y se lee de un tirón pero esperaba algo más de la autora de todos quieren a daisy jones ya que este último me encantó y hasta lloré con evelyn hugo no me ha pasado nada por el estilo","3"
"lo recomiendo sin ninguna duda cuando llevo mucha novela negra seguida intento cambiar el registro y desde luego que fue un acierto interesante emotiva y en mi caso frases que han sido toda una revelación no conocía a la autora pero ahora quiero saber mas","5"
"esta escritora lo ha vuelto hacer me he leído dos de sus libros este y todos quieren a daisy jones y  me encanta como escribe como narra la historia con todo detalle lo que transmite al leer sus libros no tengo palabras…","5"
"me a sorprendido gratamente esta novela está muy bien escrita todo tiene su sentido y te mantiene enganchado de principio a final he reído y he llorado con evelyn hugo magnifica taylor por escribir asílo recibí en 3días todo perfecto","5"
"excepcional una gran historia muy bien escrita con mucho mensaje del que da en el que pensar y reflexionar el final del libro da un gran giro que aún lo hace mejorar si se puedefelicidades a la autora seguiré leyéndote sin duda","5"
"sobrevivir a la vida y amar","5"
"te da la sensación de que va ser frívolo pero a medida que vas adentrandote das cuenta de lo duro sincerodel sufrimientopero al finala pesar de todome quedo con el mensaje de amor pasión es lo que verdaderamente importa","5"
"gracias a las autoras por esta obra me he emocionado y adorado a los personajes se sale como el amor es en mayúsculas distinto variado y único","5"
"lectura amena y un personaje femenino potente y profundo muy bien construído","4"
"me parece que las buenas críticas son injustificadas; es una novela entretenida pero poco profunda; los personajes secundarios son planos el lenguaje y el estilo narrativo es muy sencillo y la historia de amor principal no conmueve; en general le falta personalidad; quizás el final sea lo mejor del libro pero tenía otra novela de la autora en mi lista de deseos y no lo voy a leer;  una novela de verano o para gente que no suele leer sin más","3"
"esta novela me ha destruido a tantos niveles que no sé  ni por donde empezar a hablar solo diré  que la narración  es rápida  y ligera pero la historia que te cuenta es dura es un relato de rencor  ambición mentiras y verdades dolorosas pero sobre todo es una historia de amor amor por la familia la pareja y por una mismade verdad que merece la pena y además engancha muchísimo","5"
"me ha encantado increíble la pluma de la autora la facilidad para meterte en la historia y crear un personaje capaz de hacerte sentir tantas cosas super recomendable y francamente fascinante","5"
"el libro esta entretenida a ratos y ya es como leer la biografia de cualquiera de las actrices famosas en los 50 qué tuvieron que hacer para sobrevivir en hollywood qué artimañas usaron para mantenerse en la fama y todo lo que tuvieron que sacrificar… solo que en este libro se le añade un poco de representación lgbtq+no me entusiasmó la forma de escribir de la autora a veces demasiado sencilla y otras que se pasa de detallada hay bastante relleno o intentos -fallidos- para que empaticemos con la coprotagonista la periodista tampoco encontré a los personajes bien desarrollados salvo la protagonista que después de 350 páginas ya me jodería no conocerla bien","2"
"un libro preciososin duda de mis mejores lecturaste hace darte cuenta de lo que realmente importa y no para de sorprenderte en cada capítulo","4"
"también nos gusta","5"
"el pedido llegó antes de la fecha previstatodo correctoel libro me encanta","5"
"cuando comencé a leer el libro tenia muchas expectativas todas ellas se superaron la historia te engancha y no puedes dejar de leer capitulo tras capitulo finalmente se te hace corto el libro cada capitulo qué pasa se convierte en mejor que el anterior la forma d escribir de la autora es muy real y consigue que te identifiques con los personajes","5"
"una trama para hacernos creer lo que son las estrellas de hollywood cuando son otra completamente distintame ha encantado ponerme del lado de la periodista y entender a evelyn hugo","5"
"un libro maravilloso de principio a fin","5"
"una buena forma de entretenerse y aprender sobre la cultura sueca y sami con una novela de suspense que hasta el final se mantiene","4"
"novela que cuenta la vida de una familia en la suecia del s  xviii en una sociedad empobrecida y asfixiante dominada por la iglesia la familia protagonista vive en una montaña aislada en la que comienzan a suceder extrañas muertes que la protagonista y el pastor deben investigaral leerla te sientes allí aislada no puedes dejarla me encantó lo único malo fue el final demasiados hechos demasiado precipitados","5"
"comienza con un ritmo denso y pesado y va a un ritmo más y más acelerado sorprende y despista con posibles asesinos y causas para luego darte de frente con la evidencia","4"
"entiendo que escribir un libro es una tarea muy difícil y por respeto a la autora lo he terminado no me gusta que un libro deje tantas cosas a la imaginación del lector y me deje con mal sabor de boca pensando que no he entendido lo que la autora quiere expresar","2"
"el entorno en el que se desarrolla la historia es bastante desconocido para mi y ha sido muy instructivo la trama esta muy bien llevada me han enganchado sus descripciones de los parajes y el misterio","4"
"la verdad es que ha sido una agradable  sorpresa pues no había oído hablar ni del libro ni de la autora describe el frío con una intensidad que te llega casi físicamente el argumento te atrapa y llegas hasta el fin con el deseo de saber que pasó  un final sorprendente no se le puede pedir  más a un libro de misterio que te interese hasta  el final quizá  sobre  algún  espíritu  pero en general es muy ameno e interesante y te lleva a una época  muy dura donde  vivir era una aventura diaria una aventura de verdad  de la que no sabías  si podrías  salir","3"
"el libro que más me ha costado leer descriptivo al 100% pero para mi gusto demasiado pesado coge interés en las últimas 10 páginas","3"
"muy curioso el argumento me ha gustado se lee bien recomendable para un viaje o para llevar a la playa","3"
"me ha parecido un tostón después de narrarnos las vicisitudes del invierno por  latitudes altas a lo largo de todo el libro resuelve el final  de manera precipitada y chapucera no lo recomiendo","2"
"me ha mantenido durante todo el relato hasta saber el final lo que ya de por si habla bien de su escritora pues lo que se le pide a un libro es que sea capaz de mantenerte hasta su última página y esto es lo que lo hace interesante","3"
"el libro es un tostón  no he podido ni llegar a la mitadlos que dicen q muy bueno por favor lo compré x la crítica gente que no se define  trama absurda campo y campo tiempo indefinido  hacía tiempo que no dejaba un libro a la mitad","1"
"me ha cautivado descripciones sobrecogedoras por sencillas y reales en un lenguaje simple pero bello la protagonista muy bien perfilada mujer con determinación y valentía la historia intrigante lo desconocido de esas formas de vida costumbres de lapones en un contexto históricobravo","5"
"un poco difícil 😣","1"
"el libro es ameno y se lee bien","3"
"casi no he podido dejar de leerlo hasta terminarlo muy bien ambientado parece que te metes en la historia cuando lo lees","5"
"el libro me ha gustado aunque quizás al principio me costó un poco engancharme es un thriller histórico muy bien narrado e interesante por todos los datos históricos que aporta la autora hace una magnífica labor de investigación y nos dibuja las costumbres y forma de vida de unos pobres campesinos en un territorio inhóspito donde el frío y la nieve arrasan con todo además mantiene el suspense hasta el final hay enigmas que no se resuelven hasta las últimas páginas lo que hace que el lector no se aburra y quiera saber más","5"
"la historia transcurre en la laponia sueca en la zona del monte blackåsen allí es donde la autora cecilia ekbäck nos traslada para vivir un invierno lobo vargavinter como llaman los suecos a ese invierno tan largo tan frío tan crudo y de gran hambruna para la población más desfavorecida el significado lapón casi tiene que ver más con la novela aunque el sueco no se queda atrás para los lapones el invierno lobo es esa clase de invierno que nos hace recordar que somo mortales y que debemos luchar para sobrevivir porque estamos solos en este mundoes en ese entorno en el que se encuentra una familia finlandesa que ha emigrado allí porque el tío teppo un pariente les ha propuesto un intercambio de granjas así que maija su marido paavo y sus dos hijas frederika y dorotea deciden cambiar su vida lo que no suponían era que iba de ser de esa manera en un principio piensan que puede ser una oportunidad para que las fobias y los miedos de paavo hacia el mar desaparezcan ya no puede subir ni a una barca pesquera es superior a él y es maija la que lleva las riendas de su familiauna mañana frederika y dorotea encuentran el cadáver de un hombre erickson un vecino de una granja cercana maija decide avisar a los que viven por allí en ese lugar solitario que solo tiene vida cuando se reúnen en la iglesia es extraña la forma en que ha muerto erikson y maija no es capaz de dejar atrás el porqué de su muerte pero no sólo la nieve oculta los caminos también los secretos de los vecinos de maija y su familia todos tienen algo peculiar que va saliendo a la luz a lo largo del libro y que enreda todavía más la trama hasta un final insospechadoel contexto histórico es excelente para esta novela en aquellos años aún seguía viva la superstición en torno a las brujas y la iglesia siempre mediaba en los procesos de este tipo también era una época en la que la gran guerra del norte cuando carlos xii de suecia batallaba contra varios países diezmaba a la población sueca eso provocó que la agricultura se resintiera y que los impuestos para sufragar los gastos de la guerra aumentaran fue una etapa difícil para los suecos la autora nos lo muestra muy bienme costó meterme en la novela demasiado oscura para mi gusto pero poco a poco encontré el interés en ella llegó un momento en el que no podía parar porque necesitaba saber qué era lo que le sucedió a erickson hay demasiados fantasmas demasiadas incógnitas y muchos momentos llenos de tensiónla autora ha sabido transmitir muy bien ese frío que rodea a los habitantes de esa zona así como lo que supuso para ellos ese crimen violento que altera la vida de todos fue su primer libro y ha sido un éxito pero a mí me ha faltado algo sobre todo al principio lo que realmente me ha gustado es ese afán de maija por conocer la verdad y la evolución de frederika es impactante lo de esa muchacha y lo que es capaz de ver más allá de lo que ven y sienten los demás otro personaje importante es olaus el párroco de la iglesia él también desea conocer la verdad pero también tiene mucho que ocultar","4"
"perfecto","5"
"es un libro mas si no lo lees no pierdes nada es el típico libro que no engancha lento y un tanto aburrido","3"
"me ha resultado entretenido y en algunos momentos intrigante aunque resuelve demasiado rápido aún así lo recomiendo en general saludos","3"
"sin hacer spoiler puede que se convierta en uno de mis libros favoritos los nombres de los personajes son muy difíciles de asimilar al principio pero en 1-2 horas de lectura les pillas el gusto la historia te cautiva  a partir del séptimo capítulo pero vale mucho la pena espero haber inspirado alguien a leer este libro","5"
"interesante por la trama y por el mundo que refleja tan difente y ajeno me ha entretenido e inquietado bien","4"
"imprescindible contar con tu imaginación para entender el libro notas de fantasía que hacen de la historia un thriller atípico excelente ambientación","4"
"lectura interesante va enganchandote poco a poco hasta que consigue meterte en la trama al principio cuesta pero merece la pena","3"
"me parece que abusa de la ficcion con los espiritus que aparecen bien ambientada en suecia pero sobran espiritus me parece que queda muy bien reflejada la triste situacion de una mujer sola en aquella epoca","2"
"flojo","2"
"lo tengo aparcadomucha pajano creo que lo termine","1"
"el libro es intesante y cortito por lo que no se hace para nada pesado hasta el capitulo final te tiene en atencio","5"
"muy pesado en las descripciones no me gustóme está costando acabarloprometía bastante más pero demasiado lento y gris","2"
"le cuesta arrancar luego es una gran maravilla a devorar buena narración y muy fácil de leer lectura muy amena","5"
"es horrible","1"
"muy interesante la forma de escribir es amena y te va atrayendo te envuelve y quieres ir descubriendo lo que ocurre","5"
"intriga y personajes interesantes original","5"
"muy interesante la historia se desarrolla en la suecia antigua en la miseria de las clases humildes el l misterio se mantiene hasta las últimas páginas del libro","4"
"de lectura amena bien redactado te lleva a parajes helados y consigue engancharte desde el primer capitulo me gustaria leer mas libros de esta escritora","5"
"yo no he sido capaz de teeminarlo porque es una historia tan lenta con un tono general tan apagado oscuro y deprimente que acabó aburriendome nada de suspense intriga acción las páginas pasan y pasan sin que ocurra nada","1"
"te va enganchando poco a poco original y entretenida mezcla ficción historia y tradición con un estilo diferente bastante recomendable","4"
