"pues si que es una novela policiaca sobre todo porque va de policías hay drogas prostitución robo asesinato corrupciónmenudo abanicoson 105 capítulos bastante cortitos que se leen muy rápido cada uno te deja con ganas de empezar el siguiente refleja perfectamente la personalidad de los protagonistas rebeca marín una chica muy poco espabilada para su edad porque siempre ha estado volcada en los libros piensa que es hora de independizarse en muchos sentidos su padre militar de rango algo machista y chapado a la antigua su madre mujer de militar que se le viene el mundo encima con la decisión de su hijarebeca se prepara para la policía es muy estudiosa e inteligente y aprueba a la primera pasa a la academia y ahí es donde ya empieza lo difícil relacionarte en una academia con compañeros y compañeras que son capaces de meterte en un lio es otra cosa estudiar y aprobar exámenes es fácil pero cuando ya te tienen que evaluar por tu comportamientodescubriremos con ella su iniciación en la sexualidad algo que no le había preocupado hasta ahora que quiere aparentar ante sus compañeras que no está atontada se ve envuelta en el asesinato de un inspector que era odiado por todos sin comerlo ni beberlo por culpa de su inexperiencia a partir de ahí todo es liar más la madeja cualquier cosa que haga es cubrirse más de fango o que la expulsen una trampa muy bien orquestada en la que es complicado tomar una decisión sobre cual es el siguiente paso a darrebecca tiene un arduo trabajo si quiere salir del atolladero impune o con el mínimo daño posible un año lleno de tropiezos y aprendizaje sobre todo a sobrevivir y convivir con esa profesión cómo acabará su año de prácticasuna trama en la sinceramente para mi lo menos importante ha sido quien es el culpable de asesinato me he sumergido en el día a día de la protagonista y es lo que más me interesaba en varias ocasiones me había planteado si prepararme para la policía y ha sido un gustazo leer este libro he acompañado a su protagonista rebeca desde que estaba en la academia hasta acabar su año de prácticas he vivido con ella la inexperiencia y el miedo a no hacer las cosas bien a que la tomaran por tonta y no hacerse valer se le ha visto un progreso y seguridad que no tenía al principio","4"
"según comencé la lectura temí haberme equivocado con la elección pero en cuanto me recordé a mi misma que era una novela de ficción la cosa cambió el cambio de chip me permitió disfrutar de la obra sin más problemasrebeca la protagonista nos narra sus vivencias de unos años antes desde la perspectiva de los veinticuatro nos relata todo lo que ocurrió desde que con veintiún años decide hacerse policía e ingresa tras aprobar las oposiciones en la academia de ávila la historia arranca en 1997 y abarca hasta principios del 2000 y nos devuelve a una época marcada por la corrupciónla muchacha nos cuenta sus experiencias las tramas de corrupción que se encuentra tanto en la academia como en su año de prácticas también asistimos a su madurez como persona y a muchos cambios en su vida personallos capítulos cortos consiguen atraparte enseguida a pesar de la narración en primera persona y de que sólo vemos las cosas desde el punto de vista de rebecca el autor se las apaña bastante bien para darnos a conocer al resto de personajes vamos descubriendo las cosas poco a poco y a la vez que ella por eso terminando viendo que las cosas no eran siempre lo que parecíanme costó hacerme un poco con la forma de ser de rebeca es una ingenua idealista que no tiene claras algunas cosas entre ellas su propia sexualidad vemos su evolución según le ocurren cosas toma decisiones provocadas por la falta de confianza y madurez y también por no saber  en quien confiar pero no pierde la integridad la dudas propias de la juventud le dan un lado humano que se agradece y la hace más creíble es un buen contrapunto a su faceta de adalid de la justiciala novela es muy entretenida y fácil de leer se hace referencia a situaciones y personas que bien pudieron ser reales pero con nombres y situaciones modificados o al menos eso me ha parecido entenderel autor enlaza bien las diferentes tramas la historia que nos narra es coherente y resulta creíbleme lo he pasado muy bien con la lectura me ha venido genial para desconectar y pronto leeré algo más del autor","4"
"libro muy recomendable es el primero que leo de esteban navarro y no será el últimototalmente una sorpresa se aborda el tema desde una visión totalmente novedosa no me la espera asíuna vez que lo empiezas a leer no puedes dejarlo hasta acabarlo","5"
"he leído varios títulos de este autor en lo que va del verano y ahora estoy con crímenes del abecedario  vale no se tiene porqué esperar un gellida un silva una giménez bartlett o una men marías pero les falta profundidad y complejidad de trama a los personajes adentrarse un poco en sus procesos mentales conocerlos un pocose pierde la buena trama de investigación de una novela más bien corta en descripciones repetitivas de los atributos físicos sensuales y sexuales de los personajes femeninos y sus reacciones en los masculinos con una narrativa tan casposa y machacona que de a ratos fastidia bastanteincluso cuando la narrativa está hecha en primera persona y el personaje es mujer pienso que degrada e infravalora la tarea y cómo son vistas las mujeres policía y las describe como personajes que quedan más bien raros y fuera de la realidad que conozco de los ffccse  ésas descripciones físicas no se hacen en los personajes masculinos a éstos les pone nombres como celestino y edelmiro si sus edades superan los 50 años la separación generacional se remarca exageradamente en fin faltaría mucho pulido en mi opinión  algunas novelas repiten demasiado también el conflicto de equiparación y distribución de funciones de los diferentes cuerpos en cataluña de tal forma que parecen u una arenga sindical a veceslas historias no están mal y el conocimiento del funcionamiento y desviaciones del mismo desde dentro es algo que se nota en la trama y los ojos agradecenno obstante supongo que los libros están enfocados a un nicho de mercado masculino y no muy acostumbrado a la novela negra no se trata de hacer propaganda feminista simplemente les hacen falta personajes femeninos más realistas y fuertes","3"
"entretenido pero con la continua sensación de que va arrancar la aventura pero al final nada de nada mis recuerdos de esa época totalmente distintos y eso que vivía en bcncuriosa protagonista cuanto menosen fin libros escritos por mi 0 por esteban un montón así que me he puesto a buscar otros y estoy con el ajedrecista y nada que ver muy bueno el comienzo y ya tengo comprado la trilogía que empieza por su libro que fue finalista del planetaeste libro obsequio del autor grande un escritor que arriesga regalando alguno de sus libros conmigo ha acertado","3"
"esta novela de esteban navarro es totalmente diferente a las demás que él ha escrito y yo leído pero engancha desde el principio al lector de una forma prodigiosarebeca es hija única de un militar de alto rangoella es la protagonista de la trama con situaciones inesperadas pagando muchas veces los errores cometidos a causa de su inexperiencia y su inocenciame gustaría recalcar el autor describe situaciones perfectamente reales fácilmente creíbles en las que ensalza a las fuerzas del orden pese a haber algunos elementos corruptos pues en todas las épocas de la vida ha habido personas con afán de lucro rápido y además este caso todo gira en torno a los años 90no me gustaría destapar su desenlace pero en mi humilde opinión no creo los familiares de militares o policías puedan verse ofendidos por su lectura la cual es amena razonada y está tratada con respeto","5"
"esteban navarro hace un gran trabajo construyendo personajes y criticando la corrupción dentro de la policía a pesar del ritmo pausado logra atraparte y pasas un buen rato con la lectura el crecimiento de la protagonista es notable hubiera preferido más acción pero un año de prácticas no es un título desechable en absoluto","4"
"novela entretenida cómo todas las del autor en la que te sumerge en la historia personal de la protagonista en su año de practicas tras el acceso a la policía nacionalrecomendable pero de las 12 novelas que llevo leídas del autor estaría en mitad de la tabla supongo porque tiene novelas que para mí son un 10","4"
"le pongo 3 estrellas y no 2 porque el inicio de la novela engancha y la narrativa no es pesada pero a medida que vas avanzando en la lectura la trama se va diluyendo yla denuncia de la corrupción en la policía nacional y supongo que en otras administraciones esta bien al igual que los personajes estan bastantante bien definidos he comprado otro del mismo autor a ver si el epílogo es bueno y si no lo es no volveré a leerlo otra pega que veo no solo en ésta novela es que es demasiado politicamente correcto","3"
"buena novela ágil y fácil de leer en la cual se habla de todo lo que creemos saber e intuimos pero casi nadie hace nada por impedirlo ya que el que lo intenta lo dejan fuera de juego o se lo cargan toda esta corrupción es extrapolable a todos los ámbitos de la vida y así nos va muy recomendable y amena","4"
"otra novela policíaca del prolífico autor esteban navarro como casi todas sus obras tiene un gran ritmo y una narrativa sencilla de leer lo cual ayuda a que la trama enganche desde el principio y nos metamos en la piel de la protagonista la historia se desarrolla sin altibajos tampoco hay grandes sorpresas ni giros drámaticos y nos va guiando hacia un final convincenteen definitiva lo mejor una de esas novelas fáciles de leer que enganchan y se digieren bienlo menos bueno a mi entender una historia algo plana sin sorpresas no es tan buena como una historia de policías también de esteban navarro pero no se queda muy lejos","5"
"libro ameno y fácil lecturaserá cierto algo de todo lo que cuenta debate para otro foro cualquier parecido con la ficción","5"
"un libro muy entretenido fácil de leer para echar una o dos tardes relajado y olvidarte de todo lo demás","4"
"en los primeros capítulos aparece un muerto aunque sabemos que la protagonista no es la asesina las pruebas apuntan a ella a partir de ahí esperaba que la trama se centrase en las pesquisas de rebeca para probar su inocencia pero el autor nos hace un regate y nos lleva a seguir a la aspirante a policía en su lucha contra la corrupción del cuerpo","3"
"la verdad es que hacía un puñado de años que no leía nada tipo novela y aunque antes los devoraba últimamente me costaba meterme en este tipo de libros siempre tenía otras cosas que hacer o que leerpero cuando le di una oportunidad a este libro ya no pude parar me ha gustado mucho la temática cómo se describen los personajes a través de los ojos de la protagonista las situaciones etc personalmente me ha gustado mucho también los capítulos cortos y que te dejan con ganas de más eso termino por engancharme mucho y quería seguir devorando páginas","5"
"es fácil de leer y su trama engancha alguien que ha estado dentro sabe cómo funcionan las cosas y cómo deberían funcionar","4"
"una novela que me ha atrapado algo menos que otras del mismo autor es buena historia pero le falta un poco de emoción","4"
"la clasificación con 4 estrellas es porque considero que todo lo que hacemos es mejorable en líneas generales me ha gustado mucho te engancha desde el primer capítulo","4"
"como siempre no me ha defraudado me gusta el giño romantico y la busqueda de identidad de la protagonista totalmente recomendable no doy 5 estrellas porque la perfección  no existe","4"
"la trama se va diluyendo poco a poco y pasa de una novela amena y con intriga a una novela convencional poco interesante algo pesada con detalles y personajes que no aportan nada y hace que la trama principal no se resuelva bien tambien hay algunos fallos de bulto en las fechas o dias de la semana que se podrian haber evitado","3"
"una gran novela me está encantando este autor como a muchos y ahora una opinión creo que el autor no pudo evitar deslizar un poco de una lección aplicada de ética y se le perdona porque es un escritorazo","5"
"trama e historia muy bien desarrolladas te engancha desde el primer momento se debora muy buena lectura no resulta pesado","4"
"me ha gustado mucho el autor sigue en su línea de contar una historia rápida y ligera la historia se ve desde la perspectiva desde antes de estar en la policía desde la academia como se empiezan a ver cosas raras esta novela en particular tiene muchos capítulos pero muy cortitos cosa que me ha sorprendido y me ha gustado se la he pasado a mi mujer y también le está gustando mucho es un libro que hay que leer","5"
"libro de lectura amena y que te transporta a unos años atrás  buena trama y entretenida","4"
"una novela fácil de leer pero a mi personalmente no es de las que más me ha gustado de este autor  lo cual no quiere decir que sea mala ni nada por el estilo seguiremos leyendo el trabajo de esteban navarro ","3"
"un buen libro sobre el trabajo de la policía en la españa de final del siglo xx un relato que te engancha desde el principio esteban navarro denuncia a través de twitter y youtube muchas irregularidades policiales lo que le ha granjeado enemistades en el cuerpo no hagáis caso de las valoraciones negativas la mayoría son de gente que no se ha leído el libro incluso es posible que no hayan leído en su vida","5"
"una buena trama sobre un policía nacional en prácticasambientada antes del año 2000 al final del relato  todo cobra sentido","3"
"lectura apasionante narración fluida y llena de detalles muy recomendable segunda novela leída del autor que se mantiene un muy buen nivel de interés y argumentos reales","5"
"libro muy ameno y entretenido gracias a un estilo personal que me ha ido enganchando hasta el final a medida que avanzaba en la lectura rebeca es una joven e inexperta policía recién salida de la academia cuyas expectativas darán un giro después de un intenso periodo de prácticas narración muy bien planteada entre la ficción y los detalles reales me ha encantado el libro y su protagonista","5"
"ameno esclarecedor aunque sea ficción 😊 de fácil lectura","4"
"el autor fue policía y sabe de lo que habla relata minuciosamente la vida de una joven aspirante a policía que irá descubriendo la corrupción en el cuerpo también su vida personal con una sexualidad que le llevará a amar a otras mujeres igualmente veremos su valentía ante adversidades y un acontecimiento inesperado todo narrado con maestría","5"
"no conocía a este autor y me he llevado una grata sorpresa capítulos cortos que te hacen seguir con las ganas de leer más para ver qué va a ocurrir a continuación una lectura ágil que no se hace pesada en absoluto ciertamente para mí ha sido todo un descubrimiento que me ha gustado mucho","5"
"acabo de terminar la empecé hace dos días es ágil  y te hace sentir muy cercano a sus personajes ahora entiendo el porqué a un sector de la policía nacional  no le ha hecho gracia esta trama tan probablela recomiendo me ha hecho disfrutar","5"
"difícil hacer una reseña sin destripar lo que aquí se narra retrato de unas vidas que atemoriza da miedo saber que puedes formar parte de un plan trazado previamente historia que no te deja atrás con una narración espectacular imposible dejar de leer sacando horas al reloj de donde no las hay ahora a esperar la próxima novela","5"
"una novela trepidante de principio a fin es muy curioso cómo se ve crecer a la protagonista y cómo va madurando según avanza la historiaes de esos libros que te tienes que leer de una tirada porque te enganchan y no los puedes soltaruna novela estupenda","5"
"de las mejores novelas del autor en cuanto a trama y dinamismo de la acción como siempre cuidadisima documemtación y ambientación en la barcelona post-olimpica que tan bien conoce esteban me ha gustado mucho leerla","5"
"interesante y amena novela que desvela los entresijos de la corporativización de la policía expuestos como ficción y creando la duda de hasta que punto no son una denuncia de lo que ocurre realmente en muchos otros ámbitos como la política las empresas las religiones","5"
"la primera que he leído de este escritory me ha encantadoes una novela trepidante y ágilcon un lenguaje sobrio que capta tu atención desde el principio de las que hay que leer de un tirón","5"
"bueno es la primera novela que leo de este escritor y no será la última muy amena la lectura y sobretodo entretenida genial","5"
"me gustó este libro por qué desde la primera página me enganche y no podía dejar de leerlo lo recomiendo","5"
"la mejor novela hasta hoy de esteban navarro trepidante emocionante me ha enganchado desde el primer párrafo y en solo en un fin de semana me la he leído ya que no podía esperar a conocer el final de tan maravillosas novela","5"
"una buena novela policíaca plagada de corrupción la recomiendo","5"
"si te gustan los thriller policíacos deberías leer un año de prácticas","5"
"me ha encantado leeré los siguientes","5"
"un libro que te engancha desde el minuto 1","5"
"estilo ágil se lee muy fácil engancha desde la primera a la última página gran descubrimiento esteban navarro","5"
"lectura muy entretenida y recomendableme deja con gana de leer más libros del autor y con algo de pena por haberlo acabado me ha cautivado","5"
"me ha encantado me ha tenido enganchada hasta el final mil gracias esteban por tu generosidad y facilitarme la posibilidad de conocer tu obra algo que sin duda haré","5"
"excelente novela donde se nos muestra a que se enfrenta la protagonista al acceder al cnp el autor refleja muy bien los casos a los que tienen que enfrentarse los policías","5"
"me ha gustado mucho me ha robado horas de sueño porque no es fácil dejar de leer para acostarse a dormir","5"
"me ha encantado una historia que te atrapa desde el principio sin dejar de preguntarte cuánto hay de cierto en torno al corporativismo en nuestros cuerpos policiales ","5"
"me ha enganchado de principio a fin no había leído nada de este autor pero a partir de ahora lo sumaré a mi lista de preferencias","5"
"esteban navarro es siempre una garantía dentro del género y un año de prácticas es una confirmación más","5"
"nunca había leído nada de este autor y no sé si es que tenía las expectativas muy altas o es que realmente su manera de escribir es más simple que el asa de un cubo estoy completamente decepcionada","2"
"un libro ágil de leer lleno de acción donde a veces nada es lo que parece muy interesante hasta el final","5"
"engancha desde el principio te obliga a seguir leyendo y te adentra en lo más oscuro de la corrupción policial","5"
"me ha encantado tiene un ritmo trepidante desde el principio hasta el final te hace vivir la historia como si estuvieras en ella","5"
"desde la primera hoja hasta la última te mantiene en tensión he disfrutado muchode los mejores libros de esteban navarro","5"
"entretenido lectura ligera","5"
"libro entretenido y rápido de leer buena novela y gran autor muy recomendable","5"
"empieza muy bien con lo de la pobre chica pero cuando empieza a meter todos esos datos de procedimientos policiales con pelos y señales la atención decae 100%","2"
"me ha gustado mucho interesante de principio a final se lee muy bien y rápido","5"
"me ha encantado como todo lo que escribe","5"
"me leí el libro en pocos días muy interesante","5"
"mantiene la intriga hasta el final","5"
"otra magnífica novela del señor navarro y ya van…","5"
"a partir de la mitad del libro la trama pierde interés además de que el autor retuerce y retuerce el hilo conductor no la recomiendo","3"
"comienza bien pero a parte de una crítica política acertada pone en el punto de mira la corrupción policial al final el libro se hace aburrido cosa rara en este autor","1"
"le voy a puntuar con un 19describe los temas haciéndoles tan reales y creíbles que da miedo que puedan ser verdadde lectura fácil te hace plantearte qué hubieras hecho tu muy recomendable","4"
"el libro esgancha desde el primer momento","5"
"me ha gustado el libro lo he leído de un tirón en un par de días sin duda el sr navarro sabe enganchar al lectorbuenas suerte con futuros títulos","4"
"ya he leído varias novelas de esteban navarro y personalmente las encuentro entretenidas y da gusto leerlas esta en concreto se nota que la escrito una persona que ha sido policía como es su caso te sumerge en un mundo que está en nuestras vidas de una forma u otra aunque para nosotros nos pase desapercibido también como vivo en zaragoza me encanta que una parte del relato sea en esta ciudad seguiré leyendo sus obras","5"
"una novela inteligente bien documentada con ritmo y lenguaje desvergonzado recomendable","4"
"un tema que desgraciadamente nunca pasará de moda y refleja a la sociedad y al estado que tenemos tal y como son","5"
"los primeros años de la vida profesional de una joven policía sirven como excusa para presentar a la policía nacional como un cuerpo cuyos integrantes se dedican a  cometer irregularidades y  corruptelasla novela carece de interés plana y aburridano la recomiendo","1"
"100% recomendable","5"
"muy bueno el relato y lo que todos sospechamos que ocurre en muchos estamentos oficiales y que nadie quiere confirmar","5"
"-- contentos con la novela fresca original bien hilada y de rápida lectura además nos ha parecido honesta al retratar varios aspectos feos sobre el funcionamiento de la policía nacional tan en la boca de agentes en persona como en foros en cuanto a la trama y a los personajes decir que están bien sin ser una maravilla pero la novela cumple pues muestra una realidad ajena al público disfruten","4"
"sensacional una vez más esteban navarro deseando leer el próximo libro historias reales como la vida misma o acaso es una denuncia","5"
"llevaba todo el día sin comer apestaba a sudor y me olía la boca a cuernos podridosesto lo dice la protagonista  una joven en practicas de la policía nacional para que veáis la forma de escribir esta novela del escritormucha trama de corrupción policial mafia rusa y ella pasando ese año en barcelona con la academia y las prácticasaunque es de policías solo hay un muerto y no hay investigación como en una novela policiacaha estado entretenida pero tanta política me aburre me van más el suspense y la búsqueda del asesino","5"
"una trama que te engancha y que te mantiene expectante porque no sabes que más cosas pueden pasarla a la protagonista","4"
"como todas las novelas de este escritor enganchada desde el principio bien narrada y entretenida me gusta que sea de episodios cortos se hace más amena confiemos que haya mucha ficcion en la historia  ahora a esperar proxima novela de este autor","5"
"👍🏻","5"
"aun no lo he acabado y me tiene intrigadisimo atrapa desde el minuto uno y es absorbente total no te canses de escribir gracias","5"
"es el año 1997 y rebeca marín una joven de zaragoza e hija de un militar decide ser policía nacional así que después del proceso de selección y de pasar nueve meses en la escuela de ávila llega a barcelona su primer destino pocos días después el inspector novoa de extranjería un hombre con bastante mala fama entre la policía aparece asesinado con un tiro en la cabeza lo inquietante es que la bala que acabó con su vida pertenece al arma reglamentaria de un policía y lo peor es que rebeca descubre esa misma noche que su pistola no está en el sitio que la dejópoco después recibe una llamada que la indica lo que tiene que hacer para recuperar su arma y que no la acusen del crimen así comienza todo un año para rebeca lleno de momentos inesperados en todos los sentidos y lo que en un principio debería ser un año de prácticas normal y corriente se convierte en meses de incertidumbre donde la joven policía descubre la verdadera realidad del mundo en el que viveme ha sorprendido esta nueva novela de esteban navarro es diferente no se centra tanto en la acción sino en los hechos que suceden alrededor de su protagonista es una novela que está muy bien construida con capítulos cortos y con un buen ritmo y además llena de sorpresas el autor de forma natural y con respeto hacia el cuerpo de policía nos cuenta el día a día de los problemas que suceden dentro incluso nos habla del abuso de poder o la corrupción alrededor de ellosy lo que más me ha gustado ha sido el personaje de rebeca su evolución personal con sus defectos sus errores propios de la inexperiencia pero también con la perseverancia que pone en intentar arreglar ciertos puntos dentro de su trabajo que no le gustan me parece una mujer muy real sus miedos y sus dudas la hacen más humana y la conexión con ella es muy grandey para terminar comentar también que el entorno en el que se desarrolla la novela es a finales de los años 90 y por lo tanto el autor se centra en muchos puntos que iban sucediendo en esa época en esa sociedad que ha ido evolucionando poco a poco y sobre todo en lo que se refiere al desarrollo tecnológico que se vivió en poco tiempo quien era un adolescente o un joven pocos años antes del 2000 cuando lea esta novela seguro que en muchos momentos también se sentirá identificadoes un libro muy entretenido con un lenguaje sencillo y real de nuevo esteban navarro consigue cautivarme con su novela es un autor que siempre tiene algo que contar y además lo hace muy bien","5"
